{
  "lesson_id": "ar.5.1",
  "unit_id": "ar.5",
  "title_en": "Sukoon",
  "title_ar": "السكون",
  "is_checkpoint": false,
  "teach": {
    "narration_en": "Sukoon is the little circle that means 'no vowel here' — the letter just stops, closing the syllable. بَ is open (ba), بْ is closed (b). Watch for five letters especially — ق ط ب ج د — they get a little bounce when sukoon lands on them. That bounce has a name, and you'll master it fully in the Tajweed track: qalqalah.",
    "glyphs": ["قَدْ", "قَطْ", "بَعْدْ"],
    "focus_en": "Sukoon closes a syllable — no vowel, sound stops."
  },
  "items": [
    { "item_ref": "ar.5.1.listen.ba_sukoon", "type": "LISTEN_PICK", "grading_tier": 0, "prompt_asset": "letters/ba_sukoon.ogg", "answer": "بْ", "options": ["بْ", "بَ", "بِ"] },
    { "item_ref": "ar.5.1.listen.qaf_sukoon", "type": "LISTEN_PICK", "grading_tier": 0, "prompt_asset": "letters/qaf_sukoon.ogg", "answer": "قْ", "options": ["قْ", "قَ", "كْ"] },
    { "item_ref": "ar.5.1.disc.dal_taa", "type": "DISCRIMINATE", "grading_tier": 0, "prompt_asset": "letters/dal_sukoon.ogg", "answer": "دْ", "options": ["دْ", "تْ"] },
    { "item_ref": "ar.5.1.odd.vowel", "type": "ODD_ONE_OUT", "grading_tier": 0, "answer": "بَ", "options": ["بْ", "دْ", "قْ", "بَ"] },
    { "item_ref": "ar.5.1.read_aloud.qad", "type": "READ_ALOUD_SYLLABLE", "grading_tier": 1, "reference_text": "قَدْ" },
    { "item_ref": "ar.5.1.read_aloud.qat", "type": "READ_ALOUD_SYLLABLE", "grading_tier": 1, "reference_text": "قَطْ" },
    { "item_ref": "ar.5.1.read_aloud.baad", "type": "READ_ALOUD_SYLLABLE", "grading_tier": 1, "reference_text": "بَعْدْ" },
    { "item_ref": "ar.5.1.read_aloud.kam", "type": "READ_ALOUD_SYLLABLE", "grading_tier": 1, "reference_text": "كَمْ" }
  ]
}
